{
  "device_id": "sf-mid-001",
  "form_factor": {
    "type": "plush",
    "height_cm": 25,
    "weight_g": 400,
    "has_costume": false,
    "costume_friction_factor": 0
  },
  "actuators": [
    {"id": "neck_yaw", "type": "servo", "body_part": "neck", "dof": 1, "range_min": -45, "range_max": 45, "unit": "degrees", "max_speed": 200, "thermal_limit_celsius": 65, "noise_db_at_max_speed": 38, "stall_torque_nm": 0.5, "backlash_degrees": 2.0},
    {"id": "eyes_led", "type": "led_rgb", "body_part": "eyes", "dof": 2, "range_min": 0, "range_max": 255, "unit": "brightness", "max_speed": 1000},
    {"id": "speaker", "type": "speaker", "body_part": "body", "dof": 1, "range_min": 0, "range_max": 100, "unit": "brightness", "max_speed": 16000}
  ],
  "sensors": [
    {"id": "touch_head", "type": "touch_binary", "body_part": "head", "sample_rate_hz": 10, "range_min": 0, "range_max": 1},
    {"id": "mic", "type": "microphone", "body_part": "head", "sample_rate_hz": 16000, "range_min": -32768, "range_max": 32767}
  ],
  "power": {
    "battery_capacity_mah": 1200,
    "voltage_nominal": 3.7,
    "voltage_cutoff": 3.3,
    "max_continuous_draw_ma": 800,
    "charging_method": "micro_usb"
  },
  "believability_profile": {
    "max_emotion_channels": 3,
    "gesture_fluidity_score": 0.5,
    "audio_visual_sync_capable": true,
    "idle_animation_capable": true,
    "touch_responsive": true
  }
}
